publication_id,Lien Google Scholar,Editors,Book,Publisher,chercheur,chercheur_id,Titre_publication,Auteurs,Lien,Journal,Conference,date_publication,Volumes,nombre_pages,Type,BestSJR,Best Quartile
lvnns2006,https://scholar.google.com/citations?view_op=view_citation&hl=en&user=y5DKQy4AAAAJ&citation_for_view=y5DKQy4AAAAJ:d1gkVwhDpl0C,,,,amrouche hakim,CH001,L'évaluation de l'apprenant dans les environnements d'apprentissage: problématique et réflexions,Fatiha Adafer and Amar Balla and Hakim Amrouche,,International Journal of Information sciences for decision making,,2006,,,journal,,
innxt2007,https://scholar.google.com/citations?view_op=view_citation&hl=en&user=y5DKQy4AAAAJ&citation_for_view=y5DKQy4AAAAJ:qjMakFHDy7sC,Springer Berlin Heidelberg,,Springer,amrouche hakim,CH001,Interrogation of ontologies formalized in topic maps with TMQL in e-learning context,Hakim Amrouche and Marie-Hélène Abel and Amar Balla and Claude Moulin,https://doi.org/10.1007/978-3-540-72575-6_5,,"Advances in Intelligent Web Mastering: Proceedings of the 5th Atlantic Web Intelligence Conference-AWIC'2007, Fontainbleau, France, June 25-27, 2007",2007,,29-34,conference,,
dedng2008,https://scholar.google.com/citations?view_op=view_citation&hl=en&user=y5DKQy4AAAAJ&citation_for_view=y5DKQy4AAAAJ:u5HHmVD_uO8C,,,,amrouche hakim,CH001,DECOUVERTE PERSONNALISEE DES WEB SERVICES E-LEARNING,Fatiha Boudali and Amar Balla and Hakim Amrouche,,,,2008,,,,,
padts2008,https://scholar.google.com/citations?view_op=view_citation&hl=en&user=y5DKQy4AAAAJ&citation_for_view=y5DKQy4AAAAJ:zYLM7Y9cAGgC,CERAS,,,amrouche hakim,CH001,Parcours d'étudiants,Fouzia Benhaida and Hakim Amrouche and Lofti Ziani,,Revue Projet,,2008,302.0,56-56,journal,,
stpes2008,https://scholar.google.com/citations?view_op=view_citation&hl=en&user=y5DKQy4AAAAJ&citation_for_view=y5DKQy4AAAAJ:IjCSPb-OGe4C,CERAS,,,amrouche hakim,CH001,Student Experiences,Fouzia Benhaida and Hakim Amrouche and Lofti Ziani,,Revue Projet,,2008,302.0,56-56,journal,,
peeng2009,https://scholar.google.com/citations?view_op=view_citation&hl=en&user=y5DKQy4AAAAJ&citation_for_view=y5DKQy4AAAAJ:u-x6o8ySG0sC,,,CEUR-WS.org,amrouche hakim,CH001,Pertinence des Résultats de Recherche de Services Web E-Learning.,Fatiha Boudali and Amar Balla and Hakim Amrouche,https://ceur-ws.org/Vol-547/77.pdf,,CIIA,2009,,,conference,,
deaks2025,https://scholar.google.com/citations?view_op=view_citation&hl=en&user=y5DKQy4AAAAJ&citation_for_view=y5DKQy4AAAAJ:Tyk-4Ss8FVUC,Springer Nature Switzerland,International Conference on Advanced Information Networking and Applications,,amrouche hakim,CH001,Deep Reinforcement Learning Based Resource Allocation in Ultra Reliable 5G Core Networks,Amel Khamoum and Nacer Hamani and Hakim Amrouche,,,,2025,,281-291,,,
